date,URL,Title,Full text
"November 22, 2018",https://turnbackhoax.id/2018/11/22/benar-penjelasan-bawaslu-dan-kpu-terkait-kabar-pasien-pengidap-gangguan-jiwa-boleh-nyoblos-dalam-pemilu-2019/,[BENAR] Penjelasan Bawaslu dan KPU terkait Kabar Pasien Pengidap Gangguan Jiwa Boleh Nyoblos dalam Pemilu 2019,"Beberapa hari belakangan ini marak di media sosial soal kabar pasien pengidap gangguan jiwa boleh ikut memilih dalam Pemilu 2019. Kabar tersebut bermula dari berita yang dimuat oleh media daringPoskotanews.compada tanggal 12 November yang diberi judul “Pasien Gangguan Jiwa Mulai Didata untuk Pemilu”http://poskotanews.com/…/pasien-gangguan-jiwa-mulai-didata…/.
Dari pemberitaan tersebut banyak masyarakat bertanya-tanya kebenaran dari kabar tersebut.
Ketua Komisi Pemilihan Umum (KPU) Arief Budiman menjelaskan mekanisme pemungutan suara bagi pemilik suara di Pemilu 2019, yang memiliki gangguan kejiwaan.
Arief Budiman mengatakan, pasien gangguan jiwa yang memiliki hak pilih, diwajibkan menyertakan surat keterangan dokter saat akan memberikan suaranya.“Hal tersebut sudah ada regulasinya, untuk kondisi tersebut yang paling dibutuhkan adalah surat keterangan dokter yang menyatakan seseorang sanggup menggunakan hak pilih, sepanjang tak mengganggu bisa memilih, kalau mengganggu ya tidak bisa,” jelas Arief Budiman, seusai menjadi pembicara dalam Koordinasi Nasional KPU di Ecovention Ancol, Jakarta Utara, Sabtu (17/11/2018).
Arief Budiman menegaskan, mekanisme untuk pemilih dengan kondisi seperti itu sangat beragam, tergantung gangguan jiwa yang dialami dan kondisi masing-masing lokasi.
“Tetap boleh memilih, karena tidak semua yang terganggu kondisinya tidak bisa menentukan pilihan, ada gangguan yang tak pengaruhi kemampuan gunakan hak pilih,” jelasnya.
“Mekanismenya juga beragam, disesuaikan dengan masing-masing lokasi, yang penting surat dokter tadi,” sambung Arief Budiman.
Arief Budiman mengatakan, pihaknya siap menerima laporan dari masyarakat untuk mengakomodasi pemilih dengan kebutuhan khusus seperti itu.
“Prosesnya masih terus berjalan, karena kondisi pemilih seperti itu berbeda. Bisa saja kondisi sekarang berbeda dengan lima bulan mendatang. Sementara ini, pemilih dengan kondisi yang memenuhi syarat kami masukkan dalam daftar pemilih,” terangnya.
Komisioner Badan Pengawas Pemilu (Bawaslu) Mochammad Afifuddin mengatakan para pengidap gangguan jiwa yang telah telah berusia 17 tahun tetap harus didata oleh Komisi Pemilihan Umum (KPU).
Sedangkan apakah mereka memiliki hak suara atau tidak, hal tersebut ditentukan oleh rekomendasi dokter kemudian.
“Kalau ada keputusan dokter dan mereka dianggap disabilitas berat, dia hilang hak pilih, tidak bisa menggunakan hak pilih,” kata Afif di gedung Kemendagri, Jakarta, Rabu, 21 November 2018.
Afif menambahkan, bila gangguan jiwa masih bisa direkomedasikan dokter, maka masih memiliki hak pilih. Dengan cara didampingi sesuai dengan peraturan KPU.“Mereka bisa didampingi.
Afif mengungkapkan, jumlah masyarakat yang mengidap gangguan jiwa dan berpotensi mempunyai hak pilih tidak lah terlalu besar. “Sekitar 5.000an,” ujarnya.
Namun, meski jumlahnya kecil mereka tetap warga negara yang mempunyai hak pilih dan harus dilindungi hak pilihnya. “Semangat ini kan kembali ke pasal hak pilih sebagai hak dasar. Disabilitas itu kan tidak hanya fisik, mental juga,” katanya.
Selain itu, menurutnya, KPU harus terus memperbaiki diri, dengan memberikan fasilitas pelayanan bagi para kaum difabel untuk memberikan hak suara dalam pemilu.
“Yang lain juga semakin terfasilitasi, yang tunanetra semakin baiklah, ada namanya braille template. Orientasi di pelatihan penyelenggara juga ada mainstream disabilitas. TPS yang mudah dijangkau, kalau ini sudah menjadi pandangan penyelenggara ini akan memudahkan semua orang,” tuturnya.
Mahkamah Konstitusi (MK) pada 2016 lalu telah mengabulkan sebagian gugatan uji materi tentang syarat pemilih dalam UU Pilkada No.8/2015 pasal 57 ayat 3 huruf a, yang berbunyi ‘pemilih harus memuhi syarat tidak sedang terganggu jiwa atau ingatannya’.
MK menilai frasa ‘tidak sedang terganggu jiwa atau ingatannya’ tidak memiliki kekuatan hukum mengikat sepanjang tidak dimaknai mengalami gangguan ingatan permanen. Artinya, frasa ‘gangguan jiwa’ sangat luas seperti stres, paranoid, fobia yang tidak termasuk ‘gila’. Karena dalam pasal 57 tersebut tidak dirinci tentang gangguan jiwa yang dimaksud. Padahal selama ini stigma yang ada di masyarakat, gangguan jiwa adalah ‘gila’.
Keputusan MK tersebut sudah jelas, bahwa pengidap gangguan jiwa sangat luas dan harus dibedakan dengan pengidap ‘gila’. MK mengeluarkan keputusan tersebut untuk menghindari kesan diskriminatif bagi pengidap gangguan jiwa."
"November 16, 2018",https://turnbackhoax.id/2018/11/16/benar-pernyataan-pihak-kepolisian-terkait-acara-peringatan-4-tahunan-jemaah-khilafatul-muslimin-yang-akan-diadakan-di-masjid-akbar-kemayoran/,[BENAR] Pernyataan Pihak Kepolisian Terkait Acara Peringatan 4 tahunan Jemaah Khilafatul Muslimin yang akan Diadakan di Masjid Akbar Kemayoran,"Beredar selebaran undangan acara Peringatan 4 tahunan Jemaah Khilafatul Muslimin di Masjid Akbar Kemayoran, Jakarta Pusat, yang ramai di media sosial sejak hari Rabu (14/11).
Dalam undangan yang tersebar itu tertulis acara digelar pada Sabtu dan Minggu atau 16-17 November 2018. Acara peringatan itu akan diisi dengan kegiatan Tabligh Akbar, jalan sehat dan dialog.
Banyak penolakan dari warga terkait rencana penyelenggaraan acara tersebut.
Kapolres Metro Jakarta Pusat, Kombes Pol Roma Hutajulu, membenarkan soal selebaran itu. Tapi menurutnya, pengurus Masjid Akbar sudah menolak acara tersebut.
“Masjidnya sudah menolak dan setneg menolak. Masjid berada di areanya menolak. Bukan polisi ya yang menolak,” kata Roma kepada wartawan, Jakarta, Kamis (15/11).
Ditambahkan Kapolsek Kemayoran, Kompol Syaiful Anwar, beberapa warga juga menolak acara tersebut.
“Itu hanya beredar dari media sosial saja, fisik suratnya tidak ada. Tidak ada surat itu tersebar, jadi hanya postingan saja. Kalaupun ada gambar Masjid Akbar yang melaksanakan itu, itu editan saja dan diviralkan,” jelasnya.
Syaiful pun menegaskan, tidak ada acara yang dimaksudkan dalam selebaran yang beredar di media sosial. Jika memang tetap dilaksanakan secara diam-diam, warga akan menolaknya.
“Warga akan usir itu karena tidak ada pemberitahuan dan tidak ada izin. Dan saya pastikan lagi, itu tidak ada,” tegas dia.
Lebih lanjut, Syaiful menerangkan, jika acara yang sebelumnya diagendakan terselenggara di Bogor itu tetap dilaksanakan, warga akan melakukan pengusiran. Begitu juga dengan pihak kepolisian karena tidak ada permohonan izin terlebih dahulu."
"November 11, 2018",https://turnbackhoax.id/2018/11/11/benar-klarifikasi-gubernur-dki-jakarta-terkait-wacana-penghapusan-koridor-1-transjakarta/,[BENAR] Klarifikasi Gubernur DKI Jakarta Terkait Wacana Penghapusan Koridor 1 Transjakarta,
"November 9, 2018",https://turnbackhoax.id/2018/11/09/benar-bkn-bantah-umumkan-informasi-kebijakan-baru-passing-grade-untuk-cpns-agar-lulus-tes-skd/,[BENAR] BKN Bantah Umumkan Informasi Kebijakan Baru Passing Grade Untuk CPNS Agar Lulus Tes SKD,"Baru-naru ini, Beredar informasi peserta yang tak lolos tes SKD sesuai dengan nilai ambang batas (passing grade) bisa lolos.
BKN memastikan kabar tersebut adalah hoax. Penentuan lulus tes SKD tetap berdasarkan passing grade yang telah ditetapkan.
Sebagaimana kita tahu ujian SKD menggunakan sistem CAT (computer assisted test) di mana skor langsung muncul setelah selesai mengerjakan.
Banyak pelamar CPNS 2018 yang tidak lolos dalam tes SKD ini. Skor mereka tidak memenuhi passing grade yang telah ditetapkan. Misalnya, passing grade untuk jalur umum adalah 143 untuk TKP, 80 untuk TIU dan 75 untuk TWK.
Jika para peserta yang melamar sebuah formasi di CPNS 2018 tidak lolos semua bagaimana kelanjutannya ?. Menanggapi hal ini, muncul informasi tidak benar yang tersebar di media sosial.
Informasi hoax tersebut menyebutkan bahwa ‘Jika formasi yang dilamar tidak ditemukan peserta yang lolos passing grade, maka akan dirangking berdasarkan nilai kumulatif per formasi.’ Kabar ini juga menyebut sumber informasinya dari BKN.

BKN dalam akun twitternya membantah informasi tersebut, “ Percaya saja sama Tuhan & mimin. Kalau mimin belum posting hal terkait, anggap saja hoax. Sepanjang di akun resmi belum ada info, tak perlu gaduh atau risau,” tulis akun @BKNgoid.
BKN juga menambahkan bahwa Panitia Seleksi Nasional (Panselnas) CPNS 2018 sedang membahas persoalan tersebut."
"November 8, 2018",https://turnbackhoax.id/2018/11/08/benar-pihak-kepolisian-bantah-info-penculikan-kakak-beradik-di-sragen-kota/,[BENAR] Pihak Kepolisian Bantah Info Penculikan Kakak Beradik di Sragen kota,"Belum lama ini, masyarakat Sragen, Jawa Tengah kembali digegerkan dengan kabar penculikan dua orang siswi kakak beradik di Sragen Kota. Kedua kakak beradik itu diketahui Wine Maireta Anggraini (16) dan Videlis Putri Amelia (9).
Kabar penculikan keduanya mendadak heboh di media sosial sejak dua hari terakhir. Isu penculikan keduanya menyebar lewat pesan berantai dan medsos.
Keduanya dilaporkan menghilang sejak Senin (5/11/2018) siang dan hingga Rabu (7/11/2018) belum ditemukan. Dari kabar yang dishare oleh kerabat, keduanya belum pulang sejak berangkat sekolah. Kakak beradik itu masih mengenakan seragam sekolah.
Wine tercatat sekolah di SMKN 1 Sragen sedang adiknya di SDN 9 Sragen. Dalam pesan yang beredar, keduanya meninggalkan rumah dengan sepeda motor Honda Revo AD 4123 ABE. Juga disampaikan siapapun yang mengetahui keberadaannya diminta untuk menghubungi Tina, Cantel Kulon RT 3/23, Sragen Kulon.
Namun setelah tiga hari tanpa kabar, pihak Polres memastikan keduanya sudah terlacak dan tidak diculik. Kapolres Sragen, AKBP Arif Budiman menegaskan dari hasil penelusuran, posisi keduanya sudah ditemukan dan tidak menjadi korban penculikan.
“Dari keterangan keduanya, mereka sengaja kabur sendiri dari rumah. Bukan diculik. Sekali lagi kami tegaskan bahwa kabar penculikan keduanya itu tidak benar alias hoax,” papar Kapolres Kamis (8/11/2018).

Kapolres menambahkan atas fakta itu, ia mengimbau kepada masyarakat maupun pengguna media sosial untuk tak sembarangan menyebarkan informasi jika belum bisa dipastikan kebenarannya. Terlebih kabar yang berpotensi bisa menimbulkan keresahan di masyarakat seperti penculikan dan sejenisnya.
“Boleh menyampaikan kabar kehilangan, tapi jangan kemudian langsung dijustifikasi kalau itu penculikan jika memang belum bisa dipertanggungjawabkan kebenarannya. Kami mengimbau lebih baik diklarifikasi terlebih dahulu sebelum share sehingga tidak menimbulkan efek keresahan bagi masyarakat secara umum,” tandasnya."
"November 6, 2018",https://turnbackhoax.id/2018/11/06/benar-klarifikasi-bpn-prabowo-sandi-terkait-isu-penunjukkan-hotman-paris-hutapea-sebagai-pengacara-timses/,[BENAR] Klarifikasi BPN Prabowo-Sandi Terkait Isu Penunjukkan Hotman Paris Hutapea Sebagai Pengacara Timses,
"November 5, 2018",https://turnbackhoax.id/2018/11/05/benar-kepolisian-klarifikasi-terkait-biaya-tilang-baru/,[BENAR] Kepolisian Klarifikasi Terkait Biaya Tilang Baru,"Namun di tengah kondisi itu, tersiar kabar melalui pesan berantai Whatsapp yang isinya Polri mengeluarkan biaya tilang baru. Berikut narasi lengkapnya:
“BIAYA tilang terbaru di indonesia: Kapolri baru mantap
1. Tidak ada STNKRp. 500,000
2. Tdk bawa SIMRp. 250,000
3. Tdk pakai HelmRp. 250,000
4. Penumpang tdk HelmRp. 250,000
5. Tdk pake sabukRp. 250,000
6. Melanggar lampu lalin– Mobil Rp. 250,000– Motor Rp. 100.000
7. Tdk pasang isyarat mogokRp. 500,000
8. Pintu terbuka saat jalanRp. 250,000
9. Perlengkapan mobilRp. 250,000
10. Melanggar TNBKRp. 500,000
11. Menggunakan HP/SMSRp. 750,000
12. Tdk miliki spion, klakson– Motor Rp. 250,000– Mobil Rp. 250,000
13. Melanggar rambu lalinRp. 500,000.
Dicopy dari Mabes PolriInformasi yg hrs dipublikasikan & mungkin bermanfaat !!!:no_entry_sign: :no_pedestrians: :children_crossing::no_entry::warning::traffic_light::vertical_traffic_light::police_car::construction::ticket::moneybag:
JANGAN MINTA DAMAI
Segala pelanggaran di jalan Raya baik berkendara motor / mobil, “JANGAN MINTA DAMAI DAN MEMBERI UANG, KARENA ITU BERARTI MENYUAP”
Dan “Lebih baik minta di tilang, lalu nanti di urus di pengadilan”
Ini adalah Instruksi KAPOLRI kepada seluruh jajaran Polisi bahwa “Bagi POLISI yang bisa membuktikan ada warga yg menyuap Polisi, Polisi tersebut mendapatkan BONUS sebesar Rp. 10jt /1 warga dan Penyuap kena hukuman 10 tahun”
(Nah, lebih besar kan daripada uang damai yg hanya 50 ribu s/d 100 rb, jelas aja akan ada oknum Polisi yang lebih pilih menjebak karena uangnya lebih besar).
INFORMASI INI PENTING HARAP jangan MAIN-MAIN, karena info tsb diatas banyak yg tidak tahu.
Waspadai bila sekarang ada oknum Polisi sedang mencari-cari KELEMAHAN / KELENGAHAN agar kita terpancing untuk menyuap mereka dan mereka mendapat Bonus besar.
Beberapa teman mengatakan bahwa di JKT / SBY sudah banyak yg kena jebakan ini, karena banyak orang yang tidak tahu instruksi baru dari Kapolri ini.
Sebarkan berita ini ke siapa saja yg anda kenal dan kasihi, agar tidak terkena jebakan seperti ini.
WASPADALAH
“Semoga bermanfaat”
Kabar ini pun segera dibantah oleh Divisi Humas Polri melalui media sosial Twitter @DivHumas_Polri. “Beredarnya pesan melalui aplikasi WhatsApp yang berisi biaya tilang terbaru dan instruksi Kapolri terkait penilangan di Indonesia adalah hoax atau Tidak Benar. Adapun biaya denda penilangan sudah tertera dalam UU. no 22 tahun 2009 tentang Lalu Lintas dan Angkutan Jalan,” tulis akun Twitter @DivHumas_Polri, Minggu (4/11).
Jauh sebelumnya, Kepala Korps Lalu Lintas Polri Irjen Royke Lumowa menyatakan tidak ada instruksi dari Kapolri terkait biaya tilang baru. “Tulisan orang iseng tidak punya kerjaan. Tidak pernah ada instruksi itu,” Kepala Korps Lalu Lintas Polri Irjen Royke Lumowa, Jumat (8/9/2017)."
"Oktober 31, 2018",https://turnbackhoax.id/2018/10/31/benar-sri-mulyani-beri-klarifikasi-terkait-sajak-yang-berisi-tentang-keluarga-kehilangan-dan-lion-air-jt-610/,"[BENAR] Sri Mulyani Beri Klarifikasi Terkait Sajak yang Berisi tentang Keluarga, Kehilangan dan Lion Air JT 610","Berikut isi lengkap sajak yang beredar:
“Sajaknya ibu Sri Mulyani – Menkeu
… kepada kamu yang malam tadi berdebat dengan istri. Merasa lelah mendengar keluhannya yang tak henti. Membawa kesal itu dalam tidurmu, sehingga emosi belum reda pagi ini…
Berpelukanlah sebelum pamit berangkat kerja nanti.
Karena bisa jadi,Inilah waktumu melihatnya terakhir kali…
Kepada kamu yang akhir-akhir ini merasa hidup berat sekali. Kelelahan mengurus rumah sendiri, tumpuk setrikaan tanpa henti, kepusingan mengatur tagihan yang datang bertubi. Lalu diam-diam, kau kutuki karir suamimu yang tidak juga naik posisi…
Sambutlah ia ketika pulang nanti.
Katakan betapa bersyukurnya memiliki suami yang senantiasa bekerja keras dan menjaga kehalalan gaji. Ucapkan terimakasih dengan tulus hati.
Kau tidak pernah tahu, bisa jadi untuk melakukannya esok, kau tak lagi punya waktu…
Kepada kamu yang hari ini merasa pusing mendengar berisiknya anak di rumah. Padahal sepulang dari kantor mata rasanya hanya ingin terpejam dan badan butuh rebah. Lalu diam-diam, kau simpan itu menjadi emosi marah…
Tersenyumlah lebar buat mereka hari ini.Saat hendak pergi, dan saat nanti pulang kembali.
Luangkan waktu untuk menatap wajah mungil itu yang bercerita riang tentang hari harinya padamu. Dengarkan intonasi suaranya. Rekam baik-baik binar mata dan ekspresi mereka.
Karena sungguh bukan sebuah ketidakmungkinan,Besok lusa tak ada lagi kesempatan…
**
Kebersamaan menahun seringkali membuat kita lebih mudah mendeteksi kekurangan, daripada menemukan kebaikan.
Lebih lancar memberi kritik, daripada memberi apresiasi.
Lebih cenderung mengeluh. Dan lupa mensyukuri satu sama lain.
Padahal kita tidak pernah tahu kapan kebersamaan ini akan berhenti. Bisa jadi hari ini. Bisa jadi besok. Bisa jadi sebentar lagi.
Hargai setiap momen yang kita punya saat ini.
Minta maaf selagi bisa.
Berterimakasih selagi masih ada waktu.
Bercanda, berbincang, tertawa…, selagi kesempatan masih ada.
Berpelukanlah!
Selagi hangat tubuhnya masih bisa dirasa.
**
Deep condolence untuk seluruh awak dan penumpang Lion Air JT610…
Yang diantaranya ada seorang Ayah, yang pagi kemarin baru saja pamit bekerja setelah menghabiskan weekendnya untuk mengunjungi anak istri yang tinggal di Jakarta. Melepas rindu setelah sepekan tak bertemu.
Ada juga seorang Ibu yang semalam masih bercanda dengan putri kesayangannya. Menemaninya tidur. Lalu paginya berangkat untuk dinas luar kota. Bekerja. Menjemput pahala.
Dan ada pula seorang lelaki yang baru menikah dua hari. Kemarin pagi mengecup istrinya di bandara. Mesra. Sembari meminta doa. Sebelum terbang mencari nafkah pertamanya.
*
Kita betul-betul gak pernah tau.
Bisa jadi salam yang kita berikan hari ini, adalah salam terakhir buat orang-orang tercinta.
Lakukanlah selagi bisa….”
Menanggapi sajak yang telah viral tersebut pihak Kementerian Keuangan (Kemenkeu)pun memberikan klarifikasinya. Juru bicara Kemenkeu, Nufransa Wira Sakti menyatakan sajak tersebut yang mengatasnamakan Menkeu Sri Mulyani adalah tidak benar adanya.
“Setelah setelah saya konfirmasi, beliau menyatakan tidak membuat tulisan tersebut,” kata Nufransa, Rabu (31/10).
Diketahui penulis sebenarnya dari sajak tersebut ialah Jayaning Hartami. Dalam akun Facebook-nya, Jayaning yang merupakan seorang penulis menyebut bahwa sajak tersebut merupakan tulisan miliknya.
“Tulisan tentang keluarga, kehilangan, dan JT610 kemarin adalah tulisan ASLI buatan saya. Bukan buatan beberapa nama yang beredar, apalagi buatan Ibu Sri Mulyani, Menteri Keuangan kita. Kasian atuhlah kalo beliau disamain sama remah-remah momogi macem saya,” kata Jayaning.
“Saya sungguh merasa ga ahsan harus ribut ribut membahas tentang ini di tengah situasi duka. Tapi sedih juga ya ternyata saat ada yang mengira bahwa saya yang MENG-COPAS alih alih saya yang DI-COPAS?,” kata Jayaning.
Klarifikasi dari Jayaning sendiri bisa dilihat lengkapnya di link ini https://www.facebook.com/jayaning.hartami/posts/10215573386480304"
"Oktober 28, 2018",https://turnbackhoax.id/2018/10/28/benar-klarifikasi-dahnil-anzar-terkait-e-mail-skenario-coklat1/,[BENAR] Klarifikasi Dahnil Anzar Terkait ‘E-mail Skenario Coklat1’,"Kabar e-mail Dahnil kepada Hanafi dan Mustofa ini dicuit oleh akun Twitter @twitajaib pada Kamis (25/10). Ia melampirkan foto e-mail yang dikirim oleh Dahnil dan diterima oleh Hanafi serta di Cc ke Mustofa. Ketiga alamat e-mail tersebut adalah @dahnilanzar@yahoo.com, hanafi.rais@gmail.com dan mustofa.b.nahrawardaya@gmail.com.
Menanggapi kabar tersebut, Dahnil menyatakannya tidak benar atau hoaks. “Iya itu fitnah dan hoaks. Namanya itu kill the messenger, berusaha membunuh nama baik saya dan kemudian yang jelas itu hoaks, fitnah. Yang jelas saya minta polisi menangkap,” ujar Dahnil, Jumat (26/10).
Dahnil menegaskan meminta kepada pihak kepolisian untuk mencari pembuat dan penyebar foto yang menurutnya hoaks tersebut. “Saya minta pihak kepolisian untuk memburu orang yang melakukan itu. Maksudnya adalah orang yang menyampaikan itu. Karena yang jelas saya tidak mungkin melakukan itu. Saya akan sampaikan ke teman-teman tim advokasi untuk segera melaporkan tindakan itu,” katanya.
Calon Wakil Presiden (Cawapres) Nomor Urut 02, Sandiaga Uno pun mengaku sudah mengetahui informasi ini dari media daring. Namun menurutnya ini tidak menjadi pembahasan yang serius di dalam Tim BPN karena fokusnya kepada isu ekonomi dan ia pun berseloroh jika timnya tidak punya anggaran lebih guna membayar pemroduksi hoaks.
“Kami enggak punya kemewahan untuk memproduksi hal-hal lebih jauh dari isu ekonomi,” tutur Sandiaga, Sabtu (27/10).
Mustofa yang namanya dilibatkan dalam kabar e-mail Coklat1 ini mengatakan berencana akan menghubungi Direktur Siber Bareskrim Polri, Brigjen Pol Rahmat Wibowo untuk take down akun Twitter @twitajaib. “Saya rencana mau nelepon Rahmat Wibowo, habis magrib. Mau suruh take down akun @twitajaib,” imbuhnya, Jumat (26/10).
Menurut Mustofa foto e-mail itu merupakan keisengan akun-akun anonim. Katanya akun-akun tersebut ingin agar dia, Dahnil dan Hanafi dipanggil Polri.
“Supaya nanti kami, HP saya bisa dikorek-korek. Itu kan caranya mereka begitu. Saya telepon ke Hanafi juga tidak ada e-mail yang dikirim ke saya. Makanya saya mention ke Siber Polri tolong itu diperiksa akun @twitajaib itu,” ujar Mustofa.
Kepala Biro Penerangan Masyarakat (Karo Penmas) Divisi Humas Polri, Brigjen Dedi Prasetyo telah menyatakan akan melakukan pemeriksaan terhadap masalah ini. “Masih dicek dulu kebenaran informasi tersebut,” tegasnya."
"Oktober 27, 2018",https://turnbackhoax.id/2018/10/27/benar-pernyataan-timses-prabowo-sandiaga-terkait-prabowobersamahti-di-twitter/,[BENAR] Pernyataan Timses Prabowo-Sandiaga Terkait #PrabowoBersamaHTI di Twitter,"Tagar #PrabowoBersamaHTI telah menjadi trending topic di Twitter. Tagar tersebut kini telah digunakan pada lebih dari 15 ribu cuitan.
#PrabowoBersamaHTI digaungkan warganet di tengah polemik pembakaran bendera bertuliskan kalimat Tauhid yang dibakar anggota Barisan Serbaguna Nahdlatul Ulama (Banser NU) di Garut, Jawa Barat, pada Minggu lalu.
Warganet ramai-ramai mencuitkan kritik mereka terhadap Prabowo yang diduga memiliki hubungan organisasi terlarang tersebut. Sebelumnya, HTI disebut-sebut mendukung pasangan Prabowo-Sandi dalam Pilpres terkait dengan gerakan#2019GantiPresiden.
Diketahui, HTI kini dilarang karena dianggap ingin mendirikan ‘Khilafah Islam’ dan mengganti Pancasila.
Juru Bicara Badan Pemenangan Nasional (BPN) Prabowo Subianto-Sandiaga Uno, Siane Indriyani menegaskan pihaknya tidak menginisiasi tagar #PrabowoBersamaHTI.
Menurutnya, hal itu dilakukan oleh pihak-pihak yang berusaha memfitnah dengan mengaitkan Prabowo-Sandi dan Hizbut Tahrir Indonesia yang telah dilarang di Indonesia.
“Itu hanya upaya adu domba. Jangan teruskan bikin fitnah yang macam-macam lah,” tutur Siane, Jumat (26/10).
Siane juga menampik Prabowo-Sandi bakal melegalkan kembali HTI jika terpilih melalui Pilpres 2019 mendatang. Ia pun kembali menegaskan bahwa isu tersebut dimainkan oleh pihak yang ingin menjatuhkan citra Prabowo-Sandi.
Dia tidak menyebut siapa pihak yang berupaya memfitnah Prabowo-Sandi. Siane hanya mengatakan alangkah baiknya jika tidak ada lagi fitnah dan kabar bohong atau hoaks.
“Stop bikin fitnah, hoaks,” kata Siane.
Anggota Badan Komunikasi DPP Partai Gerindra Andre Rosiade mengatakan tagar tersebut merupakan salah satu bentuk kampanye hitam.Dia juga menyingung bahwa ini adalah taktik politik sontoloyo.
“Itu cara politisi sontoloyo, tagar#PrabowoBersamaHTI berarti ini cara kampanye hitam untuk mendiskreditkan Prabowo. Ini tanda tanda orang panik takut kalah,” kata Andre, Jumat (26/10).
Fact Checker : Levy Nasution"
"Oktober 26, 2018",https://turnbackhoax.id/2018/10/26/benar-klarifikasi-komisi-hukum-mui-terkait-isu-akan-melaporkan-gp-ansor-dan-banser-ke-polisi-terkait-kasus-pembakaran-bendera/,[BENAR] Klarifikasi Komisi Hukum MUI Terkait Isu Akan Melaporkan GP Ansor dan Banser Ke Polisi Terkait Kasus Pembakaran Bendera,
"Oktober 25, 2018",https://turnbackhoax.id/2018/10/25/benar-tanggapan-gubernur-babel-dan-kepala-dinas-pupr-babel-terhadap-taman-pemprov-yang-mirip-mata-dajjal/,[BENAR] Tanggapan Gubernur Babel dan Kepala Dinas PUPR Babel terhadap Taman Pemprov yang Mirip Mata Dajjal,"Banyak warganet yang memposting sebuah foto Taman Pemprov Bangka Belitung yang diambil dari google maps, yang disebut oleh warganet mirip dengan mata Dajjal.
Taman ini sedianya untuk ruang terbuka hijau (RTH) terletak diantara kantor Dinas PUPR dan Disperindag Babel.
Tulisan dan foto Taman Pemprov Babel mirip mata Dajjal telah beredar sejak Selasa (23/10).
Gubernur Bangka Belitung, Erzaldi Rosman, menanggapi viralnya foto tersebut mengatakan taman itu tidak dibuat menyerupai mata Dajjal. Tetapi, foto tersebut bisa saja diasumsikan dengan pendapat yang berbeda-beda.
Bila memang taman tersebut mirip dengan simbol Dajjal, Gubernur pun memintanya agar dirubohkan saja.
“Tidak begitu, kalau ada, rubah saja, kalau begitu,” katanya, ketika dikonfirmasi akan hal ini, Rabu (24/10) siang.
Penasaran adanya laporan viral taman pemprov Babel mirip mata Dajjal, Gubernur pun mencari gambar tersebut melalui ponselnya.
Melalui Google Map, gubernur mencoba melihat penampakan taman tersebut dari udara.
Kepala Dinas PUPR Babel, Noviar Ishak membantah bila taman yang viral mirip simbol Dajjal itu dibangun oleh dinas yang dikepalainya.
Taman tersebut dibangun oleh Dinas Perumahan Rakyat dan Kawasan Permukiman (PRKP).
“Kebetulan lokasi disebelah kantor saya.
Untuk diketahui taman pemprov Babel yang disebut-sebut mirip simbol Dajjal dibangun tahun 2016. Pemprov mengalokasikan dana pembangunannya Rp 1 miliar.
Perusahaan yang mengerjakan proyek taman tersebut adalah PT Alkomber Karya. Sayangnya, karena keterbatasan dana dan tak masuk proyek prioritas, pembangunan taman terhenti.
Fact Checker : Levy Nasution"
