date,URL,Title,Full text
"Maret 5, 2019",https://turnbackhoax.id/2019/03/05/benar-penjelasan-lengkap-terkait-unggahan-yang-bergambar-ridwan-kamil-yusuf-mansur-dan-tgb-soal-dugaan-kasus-hukum-yang-menimpa-mereka-di-media-daring/,"[BENAR] Penjelasan Lengkap terkait Unggahan yang Bergambar Ridwan Kamil, Yusuf Mansur, dan TGB soal Dugaan Kasus Hukum yang Menimpa Mereka di Media Daring","Beredar di media sosial sebuah unggahan yang bergambar Ridwan Kamil, Yusuf Mansur, dan Tuan Guru Bajang (TGB) Zainul Majdi, soal dugaan kasus hukum yang menimpa mereka di media daring.
Unggahan tersebut membuat salah satu anggota Forum Anti Fitnah, Hasut, dan Hoax (FAFHH) di media sosial Facebook yang mempertanyakan kebenaran.
Berdasarkan penelusuran di alat pencarian Google, dari ketiga pemberitaan di media daring yang menyebut ketiga nama tokoh masyarakat tersebut adalah benar adanya.
Yang pertama kita bahas yakni mantan Walikota Jawa Barat, Ridwan Kamil, seperti unggahan tersebut yang menunjukkan berita di media daring Tempo.co pada tanggal 10 Juli 2015 berjudul “Kasus Bansos Rp 1,3 M, Kejaksaan Panggil Ridwan Kamil”.
Isi dalam berita itu menyebutkan bahwa Kejaksaan Tinggi Jawa Barat berencana memanggil Wali kota Bandung Ridwan Kamil terkait dengan upaya penyelidikan dugaan korupsi dana hibah bantuan sosial (bansos) Kota Bandung tahun 2012. Dana bansos tersebut diberikan kepada Bandung Creative City Forum (BCCF) yang diketuai Ridwan Kamil.
“Ya, benar, Ridwan Kamil akan dipanggil. Tapi ini masih tahap penyelidikan. Nanti akan dimintai klarifikasi terkait program-program BCCF,” ujar Kepala Seksi Penerangan dan Hukum Kejaksaan Tinggi Jawa Barat Suparman kepada Tempo, Jumat, 10 Juni 2015.
Menurut dia, BCCF saat itu menerima dana bansos dari Pemerintah Kota Bandung sebesar Rp 1,3 miliar. Namun, untuk letak dugaan korupsi dari dana tersebut, Suparman belum bisa menjelaskan. “Tunggu nanti, setelah kami lakukan penyelidikan. Pasti nanti kita kasih kabar,” ujar dia.
Adapun pada agenda pemanggilan nanti, Ridwan Kamil akan dimintai keterangan dalam kapasitasnya sebagai ketua BCCF di tahun 2012. “Nanti akan dimintai klarifikasi terkait program-program BCCF,” kata Suparman.
Dikutip dari berita yang dimuat Merdeka.com berjudul “Ini penjelasan Ridwan Kamil soal dugaan korupsi BCCF” pada tanggal 17 September 2015, Ridwan Kamil menjelaskan klarifikasinya saat diperiksa di Kantor Kejati Jabar Jalan LL RE Martadinata (Jalan Riau), Bandung, Kamis (17/9) pukul 15.30 WIB dan keluar pukul 17.30 WIB,. Mengenakan pakaian safari plus peci dia tidak terlalu banyak bicara pada wartawan.
“
Ada pun yang ditanyakan penyidik Kejati Jabar adalah pertanggungjawaban kegiatan yang dibuat BCCF. Sebab komunitas kreatif tersebut sudah menerima dana hibah dari Pemkot Bandung Rp 1,3 miliar.
“Yang ditanyakan tadi, bahwa Saya pernah menjabat ketua BCCF. Kemudian ada yang melaporkan dan minta pertanggungjawaban apa yang dikerjakan dan kegiatannya apa,. Nah ini kegiatannya,” ungkap dia sembari memperlihatkan dokumentasi kegiatan BCCF dalam bentuk majalah.
Menurutnya BCCF lahir dari organisasi kreatif yang ingin memberikan kontribusi untuk Kota Bandung. Serangkaian kegiatan pada tiga tahun lalu itu salah satunya gelaran Helarfest. “Kami ini organisasi baik-baik. Orang kreatif. Dana yang diberikan sudah dibelanjakan, sudah sesuai,” ungkapnya.
Seluruh rangkaian kegiatan berikut pertanggungjawabannya juga menurut dia, sudah dilaporkan, berikut audit BPK yang dilakukan pada 2013 lalu. “Sudah dilaporkan, sudah diperiksa BPK, dan tidak ada masalah, tidak ada temuan (dugaan korupsi). Yang terakhir itu yang harus ditekankan,” tandasnya.
“
Isi dalam berita tersebut adalah kasus dugaan penipuan berkedok investasi dengan terlapor Ustaz Yusuf Mansur  dinaikkan dari tahap penyelidikan ke tahap penyidikan.
Kuasa Hukum pelapor Roso Wahono, warga Ngawen, Candirejo, Klaten, Jawa Tengah, Darso Arief mengapresiasi langkah polisi yang menaikkan status dari penyelidikan ke penyidikan setelah menemukan dua alat bukti yang cukup terkait tindak pidana ITE yang bermuatan penipuan dengan modus penanaman modal patungan usaha.
“Tawaran penanaman modal itu dipublikasikan melalui website  www.patunganusaha.com dengan janji akan mendapatkan keuntungan,” ujarnya.
Darso menambahkan, kliennya, Roso Wahono telah mendapatkan surat dari Direktorat Reserse Kriminal Khusus Polda DIY tentang SP2HP (Surat Pemberitahuan Perkembangan Hasil Penyelidikan).
Dikatakan, surat yang ditandatangani Direktur Reserse Kriminal Khusus Polda DIY Kombes Gatot Agus Budi Utomo itu menyebutkan polisi mendapat bukti yang cukup adanya dugaan tindak pidana ITE yang bermuatan penipuan terkait penawaran penanaman modal patungan usaha yang dimuat dalam website www.patunganusaha.com dengan janji mendapatkan keuntungan sebagaimana yang  dimaksud dalam pasal 45 ayat (1) jo pasal 28 ayat (1) UU no.19/2016 tentang  perubahan atas UU no.11.2008 tentang Informasi dan Transaksi Elektronik.
“Kasus ini sudah naik ke penyidikan sejak 4 Desember sebagaimana surat dari Direktorat Reserse Kriminal Khusus Polda DIY,” kata Darso Arief, Rabu (12/12).
Darso mengemukakan jumlah korban dugaan penipuan investasi di DIY diperkirakan mencapai ribuan orang. Sebagian besar korban, sebut Darso, rata-rata memutuskan ikut investasi setelah memperoleh informasi melalui media sosial atau forum-forum pengajian Ustaz Yusuf Mansur.
Lebih lanjut ia mengemukakan, kliennya menginvestasikan dananya sebesar Rp12 juta. Namun, dalam perjalanannya tidak mendapatkan hak-hak sebagaimana yang yang dijanjikan.
Karena itu, ujarnya, pada 30 November 2017 lalu kliennya melapor ke Polda DIY.
“Diawali dengan laporan pengaduan pada 30 November 2017, kemudian padsa 29 November 2018 menyampaikan laporan polisi,” katanya.
Pada Selasa (4/12), ujarnya, Polda DIY mengeluarkan SPDP (Surat  Pemberitahuan Dimulainya Penyidikan) dengan surat nomor  SPDP/74/XII/2018/Ditreskrimsus dan keluarnya Surat Perintah Penyidikan no. SP.Dik/718/XII/2018 Ditreskrimsus.
“Polisi memang belum melakukan penetapan tersangka,” jelasnya.Tokoh masyarakat yang kita bahas adalah Tuan Guru Bajang (TGB) Zainul Majdi. TGB juga tertera dalam unggahan warganet tersebut, namanya masuk dalam berita yang dimuat oleh Tempo.co berjudul “Dugaan Kerugian Negara dalam Kasus Newmont yang Menyeret TGB” pada tanggal 18 September 2018.
Isi berita tersebut tertuliskan bahwa Komisi Pemberantasan Korupsi (KPK) menduga ada unsur kerugian negara dalam deviden hasil penjualan saham PT Newmont Nusa Tenggara kepada PT Amman Mineral Internasional yang diduga melibatkan mantan gubernur Nusa Tenggara Barat (NTB) Tuan Guru Bajang (TGB) Zainul Majdi. Penyelidikan KPK atas kasus ini sedang berjalan, di antaranya dengan memeriksa TGB.
Kasus ini berawal dari pembelian 24 persen saham hasil divestasi Newmont oleh PT Multi Daerah Bersaing pada November 2009. Perusahaan ini adalah kongsi perusahaan daerah PT Daerah Maju Bersaing (perusahaan bentukan pemerintah daerah NTB, Kabupaten Sumbawa, dan Sumbawa Barat) dan PT Multi Capital (anak usaha PT Bumi Resources, Grup Bakrie). Hasilnya, 6 persen untuk Daerah Maju Bersaing dan 18 persen untuk Grup Bakrie.
Namun karena terus merugi, pemerintah NTB pun menjual 6 persen saham bagian mereka di Newmont pada November 2016. Ini bagian dari penjualan 24 persen saham PT Multi Daerah Bersaing kepada PT Amman Mineral Internasional senilai Rp 5,2 triliun, yang belakangan diakuisisi PT Medco Energi Internasional.
Pemerintah daerah menjual saham Newmont karena perusahaan itu, berdasarkan saran sejumlah ahli kepada Gubernur, tak punya masa depan. PT Multi Capital, misalnya, beberapa kali tidak membayar advanced dividend. PT Multi Capital juga ditengarai bermasalah saat pembagian dividen pada 2010 dan 2011.
Penjualan 24 persen saham perusahaan patungan itu kepada PT Amman Mineral Internasional senilai US$ 400 juta pada 2016 ini diduga bermasalah. Meski PT Daerah Maju Bersaing memiliki 25 persen saham di perusahaan patungan, uang yang diterima hanya US$ 40 juta, tidak US$ 100 juta. “Selisih ini yang akan menjadi penghitungan kerugian negara,” ujar salah seorang aparat hukum yang mengetahui kasus ini sebagaimana dikutip dari Majalah Tempo edisi 17 September 2018.
Menurut TGB, angka US$ 40 juta merupakan penghitungan tim penasihat investasi daerah. “Kami minta senilai valuasi dari perusahaan daerah ini sebagai pengganti investasi,” ujar TGB kepada Tempo, Jumat, 14 September 2018. Ia berdalih daerah tidak menuntut US$ 100 juta karena PT Multi Capital masih harus membayar utang dari modal yang dikeluarkan saat pembelian saham.
Dikutip dari media daring Kompas.com berjudul “3 Klarifikasi TGB soal Pemberitaan Divestasi Saham Newmont” pada tanggal 19 September 2018, TGB mengklarifikasi tiga hal terkait pemberitaan dirinya di salah satu media nasional edisi 17 dan 18 September 2018.
Pemberitaan itu terkait topik dugaan korupsi dalam proses divestasi saham PT Newmont Nusa Tenggara (PT NNT).
Tiga poin yang diklarifikasi TGB adalah sebagai berikut:
1. Divestasi dan penjualan saham Newmont.
“Masalah divestasi Newmont dan penjualan saham ada dua tahap. Ini diproses secara kolektif dan kolegial oleh tiga entitas pemerintahan, yaitu (Provinsi) NTB, (Kabupaten) Sumbawa Barat dan (Kabupaten) Sumbawa. Tidak benar hanya pemerintahan NTB,” kata TGB dalam konferensi pers di Restoran Penang Bistro, Jakarta, Rabu (19/9/2018).
TGB menjelaskan pembentukan perusahaan bernama PT Daerah Maju Bersama (DMB) dilakukan sesuai peraturan yang ada serta kolektif melibatkan tiga pemerintahan tersebut. TGB juga menyebutkan proses penjualan 6 persen bagian saham milik PT DMB dalam perusahaan konsorsium PT Multi Daerah Bersaing (MDB) dilakukan atas kesepakatan bersama dengan seluruh pemegang saham.
Penjualan saham yang dimaksud kepada PT Amman Mineral Internasional yang telah mengakuisisi PT NNT. “Bahkan saya ingat betul tanda tangan saya adalah tanda tangan terakhir persetujuan dari seluruh penerima saham untuk menjual 6 persen dari milik daerah yang ada pada dalam konsorsium bersama pihak swasta,” kata dia.
2. Kerugian negaraIa juga membantah laporan salah satu media nasional yang menyebutkan kerugian negara akibat dugaan pelanggaran dalam divestasi saham PT NNT hingga Rp 223,69 miliar.
“Lalu pemanfatan yang diperolah secara total sampai selesai penjualan saham, 127 juta dollar (Amerika Serikat) yang kita kurs-kan sekarang bisa mencapai Rp 1,8 triliun. Bagaimana bisa disebut kerugian?” ujar TGB.
Ia menceritakan, divestasi saham Newmont pada waktu itu ditawarkan ke pemerintah pusat. Namun demikian, pemerintah menolak karena tidak disetujui oleh DPR. Akhirnya, kata dia, saham itu ditawarkan ke pemerintah NTB untuk dibeli.
“Pilihannya hanya dua, kita mau terima tawaran caranya bagaimana? Kan enggak ada uangnya atau kita lepas saja? Kalau kita lepas, tidak dapat apa-apa. Maka penawaran ketiga adalah ke perusahaan secara langsung,” papar dia.
Pada akhirnya, tiga pemerintahan ini mencari pihak lain yang bisa memberikan bagian paling besar bagi daerah. Pada waktu itu pilihan jatuh kepada pihak yang mau menghibahkan 25 persen saham perusahaan patungan kepada daerah.
“Maka opsi terbaik adalah menggandeng di mana pihak ketiga share saham atau bagian. Itulah hakikatnya ditawarkan, berjalan penjualan saham totalnya 127 juta dollar. Daerah tidak dirugikan justru menurut saya secara faktual daerah diuntungkan,” ujarnya.
TGB menuturkan, semua transaksi itu didukung dengan dokumen-dokumen yang valid. Ia membantah dirinya berlaku seenaknya terkait kebijakan tersebut.
“Ada proses yang ditempuh pada saat divestasi proses yang dibentuk perusahaan menggunakan rezim perusahaan daerah atau perusahaan terbatas, (menggunakan) Undang-undang tentang Perseroan Terbatas lalu diperkuat dengan peraturan daerah,” paparnya.
3. Dugaan aliran dana
TGB juga membantah laporan media tersebut yang menyebutkan ada dugaan aliran dana dari perusahaan milik pihak swasta yang tergabung dalam perusahaan konsorsium ke rekening Bank Syariah Mandiri miliknya senilai Rp1,15 miliar pada 2010.
Dalam laporan media itu, KPK disebut menduga uang itu berkaitan dengan pembelian 24 persen saham hasil divestasi Newmont oleh PT MDB pada November 2009.
Terkait dugaan itu, TGB mengaku uang tersebut merupakan uang pinjaman dari pemilik perusahaan dari pihak swasta yang tergabung dalam konsorsium PT MDB. Perusahaan dari pihak swasta itu dimiliki oleh Rosan Roeslani.
Uang itu, kata dia, tidak berkaitan dengan divestasi Newmont.
“Jauh sebelum dimulainya proses penyelidikan atau proses pengumpulan keterangan dari KPK itu sudah dibuat perjanjian itu (terkait pinjaman). Bapak Rosan menyampaikan kepada saya pada tahun 2013, 2014, KPK sempat datang (ke kantor perusahaan) lalu diberikan copy dari salinan perjanjian itu,” katanya.
Perjanjian itu, kata TGB, khusus antara dirinya dan pihak Rosan. Ia pun mengungkapkan, sudah melunasi pinjaman itu secara bertahap. “Akad ini sudah ada, mengikat saya dengan yang meminjamkan. Akad perdata urusan saya,” ujar dia.
Dari tiga poin itu, TGB meminta kepada media nasional yang bersangkutan untuk tak sembarangan mencocokan berbagai hal tanpa melalui verifikasi dan klarifikasi. “Saya hanya bisa menyampaikan bahwa tidak boleh kita menghukum atau menuduh seseorang menggunakan rumus untuk mencocokan gitu,” ujar dia."
"Maret 5, 2019",https://turnbackhoax.id/2019/03/05/benar-klarifikasi-kpk-terkait-isu-mengusulkan-penghapusan-lhkpn/,[BENAR] Klarifikasi KPK Terkait Isu Mengusulkan Penghapusan LHKPN,
"Maret 5, 2019",https://turnbackhoax.id/2019/03/05/benar-gatot-nurmantyo-bantah-isi-pesan-berantai-yang-mencatut-namanya/,[BENAR] Gatot Nurmantyo Bantah Isi Pesan Berantai Yang Mencatut Namanya,"Belum lama ini, beredar pesan berantai di aplikasi chatting Whatsapp yang mengatasnamakan mantan panglima TNI, Jendral (Purn) TNI Gatot Nurmantyo. dalam pesan berantai itu menyebut bahwa kalaupun Indonesia harus berperang melawan Negara lain dalam konteks ini adalah China, maka Indonesia hanya bisa bertahan selama 3 hari.
Menanggapi pesan berantai yang cukup panjang tersebut, Gatot Nurmantyo menegaskan bahwa tulisan yang mencatut namanya itu adalah tidak benar atau Hoaks.
Melalui akun instagram miliknya @nurmantyo_gatot, Gatot mengcapture isi pesan berantai itu disertai caption bantahan bahwa itu bukanlah statement dari dirinya.
“Beredar pesan di Whatsapp yang mengatasnamakan saya. Saya tegaskan, informasi ini bukan dari saya! Ini adalah HOAX! Mohon kiranya untuk berhenti menyebarkan pesan-pesan ujaran kebencian seperti ini.” tulisnya."
"Februari 26, 2019",https://turnbackhoax.id/2019/02/26/benar-ridwan-kamil-bantah-artikel-ridwan-kamil-di-jawa-barat-kita-akan-mendata-siapa-saja-yang-tidak-mendukung-jokowi/,[BENAR] Ridwan Kamil Bantah Artikel “Ridwan Kamil: Di jawa Barat Kita Akan Mendata Siapa Saja Yang Tidak Mendukung Jokowi!!”,
"Februari 24, 2019",https://turnbackhoax.id/2019/02/24/benar-caleg-pdip-minta-maaf-atas-viral-senam-di-atas-sajadah/,[BENAR] Caleg PDIP Minta Maaf atas Viral Senam di Atas Sajadah,
"Februari 19, 2019",https://turnbackhoax.id/2019/02/19/benar-penjelasan-terkait-pernyataan-prabowo-soal-impor-air-di-debat-capres/,[BENAR] Penjelasan terkait Pernyataan Prabowo soal Impor Air di Debat Capres,"Debat capres ke-2 yang mengangkat tema energi, pangan, infrastruktur, sumber daya alam, dan lingkungan hidup, Minggu (17/2), panasnya debat tersebut masih berimbas hingga sekarang.
Terlebih dengan adanyacekfakta.com, pernyataan dari kedua capres yang bertanding di debat capres langsung dibuktikan kebenarannya.
Yang masih luput dalam pengecekan fakta dari debat tersebut adalah perkataan dari capres nomor urut 02, Prabowo Subianto, yang sebut perihal impor air yang dilakukan oleh negara Indonesia.
Banyak warganet yang mempertanyakan kebenaran dari perkataan dari Prabowo tersebut dengan narasi yang beragam.
Agar tidak fitnah dan meredam panasnya pembahasan di warganet terkait impor air.
Berdasarkan penelusuran yang dikutip daricnbcIndonesia.com, terbukti bahwa Indonesia melakukan impor air setiap tahunnya sejak tahun 1989 hingga sekarang. Selain impor Indonesia juga ekspor.
CNBC Indonesia mengambil data perdagangan luar negeri yang dikompilasi oleh UN Comtrade (sebuah Lembaga PBB).
Menurut data UN Comtrade, air yang dimaksud data perdagangan tersebut adalah semua air yang masuk dalam golongan kode HS 2201.
HS 2201 adalah air, termasuk air mineral alam atau artifisial dan air soda, tidak mengandung tambahan gula atau bahan pemanis lainnya, maupun pemberi rasa; es dan salju."
"Februari 15, 2019",https://turnbackhoax.id/2019/02/15/benar-kemenristek-dikti-bantah-surat-terkait-pengembangan-hybrid/,[BENAR] Kemenristek Dikti Bantah Surat Terkait Pengembangan Hybrid,"Beredar informasi mengenai surat yang mengatasnamakan Direktorat Jenderal Pembelajaran dan Kemahasiswaan (Ditjen Belmawa) Kementerian Riset, Teknologi, dan Pendidikan Tinggi (Kemristekdikti).
Surat bernomor 27/B2.3/TU/2019 ini berisi undangan kepada Direktur Akademi Manajemen Administrasi Yogyakarta untuk datang dalam acara Bimbingan Teknis Pengembangan Konten Hybrid Learning dengan Skema Transfer Kredit.
Dalam surat itu juga disebutkan bahwa acara bimbingan akan berlangsung pada Rabu dan Kamis (20-21/2/2019) pukul 07.30-17.00 WIB di Hotel Le Meridien, Jalan Jenderal Sudirman Kavling 18-20 Sudirman Jakarta Pusat.
Menurut informasi yang didapat, surat ini diterima pihak Ditjen Belmawa Kemenristek Dikti pada Kamis (14/2/2019).
Menanggapi hal tersebut, Kepala Seksi Pengakuan Pembelajaran Lampau Ditjen Belmawa Kemristek Dikti, Alam Nasrah Ikhlas menegaskan bahwa surat tersebut bukan dari pihak Ditjen Belmawa.
“Ditjen Belmawa tidak pernah mengeluarkan surat seperti itu,” ujar Alam saat dihubungi Kompas.com pada Kamis (14/2/2019).
Alam mengungkapkan bahwa Ditjen Belmawa mendapatkan laporan adanya surat palsu pada Kamis (14/2/2019) pagi hari.
“Ada dua orang yang nanya ke saya, satu dari sesama kolega di kementerian dan satunya dari kolega saya di kampus. Katanya surat itu masuk ke email kampusnya,” ujar Alam.
Alam mengatakan bahwa ada perbedaan yang cukup signifikan antara surat palsu dengan surat asli.
“Dari penggunaan format penulisan suratnya, seperti kop, penggunaan font, dan lainnya. Ada aturan standardnya,” kata dia.
Kemristek Dikti juga memberikan imbauan kepada masyarakat untuk berhati-hati dengan surat palsu atau penipuan yang mengatasnamakan pihak Kemristekdikti.
Selain itu, akun instagram ristekdikti juga memberikan klarifikasinya terkait surat tersebut.
“#SobatRistekdikti, dihimbau tetap berhati-hati dengan surat palsu atau penipuan yang mengatasnamakan @ristekdikti.Direktorat Jenderal Pembelajaran dan Kemahasiswaan (@dibelmawa) tidak pernah mengeluarkan surat seperti yang ada pada gambar berikut,” ujar akun tersebut."
"Februari 14, 2019",https://turnbackhoax.id/2019/02/14/benar-penjelasan-terkait-informasi-mobil-berstiker-prabowo-sandi-tidak-boleh-masuk-kebun-raya-bogor/,[BENAR] Penjelasan Terkait Informasi Mobil Berstiker Prabowo-Sandi Tidak Boleh Masuk Kebun Raya Bogor,"Beredar di media sosial sebuah unggahan yang bernarasi informasi adanya mobil pengunjung berstiker pasangan calon dalam Pilpres 2019, Prabowo Subianto-Sandiaga Uno, tidak boleh masuk ke Kebun Raya Bogor.
Informasi ini beredar di media sosial Twitter pada Rabu (13/2/2019).
Dalam twit tersebut dituliskan “Beredar Broadscast via WhatsApp >>> Mobil yg ada stiker Prabowo / 02 Tidak diperbolehkan masuk Kebun raya Bogor. Benar atau Hoax?”.
Kemudian, akun tersebut juga mengunggah foto yang menampilkan dua orang tengah berpose dengan latar belakang mobil yang ada beberapa stiker paslon nomor 02, Prabowo Subianto-Sandiaga Uno.
Pada foto juga diberi keterangan bahwa mobil yang ada stiker Prabowo tidak diperbolehkan masuk ke Kebun Raya Bogor.
Pihak Kebun Raya Bogor pun memberikan klarifikasi terkait informasi yang beredar itu.
Dilansir dariKompas.com, Manajer Hubungan Masyarakat Kebun Raya Bogor Ayi Doni Darussalam Jasin mengungkapkan bahwa Kebun Raya Bogor merupakan satuan kerja di bawah Lembaga Ilmu Pengetahuan Indonesia, sehingga perlu dijaga untuk tetap netral dan non politis.
“Hal tersebut adalah kesalahpahaman. Setelah kami konfirmasi kepada tim lapangan, yang bersangkutan dipersilakan masuk juga,” ujar Manajer Hubungan Masyarakat Kebun Raya Bogor Ayi Doni Darussalam Jasin saat dihubungiKompas.compada Rabu (13/2/2019).
Meski begitu, Doni mengakui bahwa mobil yang jadi polemik itu memang sempat tak diperbolehkan masuk oleh salah satu petugas.
Doni menjelaskan bahwa polemik bermula saat petugas yang berwenang khawatir Kebun Raya Bogor dianggap tidak netral dalam Pilpres 2019.
Karena itu, mobil itu sempat tertahan di pintu masuk. “Atas kesalahpahaman tersebut, kami mohon maaf apabila ada ketidaknyamanan bagi pengunjung,” kata Doni.
Selain itu, Doni juga mengungkapkan bahwa Kebun Raya Bogor punya beberapa larangan dan aturan bagi pengunjung.
Aturan itu seperti dilarang membawa hewan peliharaan ke dalam Kebun Raya Bogor karena dikhawatirkan mengganggu pengunjung lain.
Kemudian, tidak diperkenankan untuk melakukan corat-coret atau vandalisme di fasilitas Kebun Raya Bogor dan tidak boleh memetik daun pada pohon koleksi.
“Tidak diperkenankan juga untuk merusak fasilitas lain dan tidak boleh menerbangkan drone,” ujar Doni."
"Februari 8, 2019",https://turnbackhoax.id/2019/02/08/benar-klarifikasi-ridwan-kamil-terkait-tudingan-bermain-dua-kaki/,[BENAR] Klarifikasi Ridwan Kamil Terkait Tudingan Bermain Dua Kaki,"Akun media sosial Gubernur Jawa Barat (Jabar) Ridwan Kamil atau yang 
akrab disapa Kang Emil membuat postingan yang berisi klarifikasi. 
Postingan tersebut berisi foto beberapa perempuan Korea Selatan yang 
sedang menunjukan simbol finger heart dan disandingkan dengan foto 
dirinya bersama Calon Wakil Presiden (Cawapres) Sandiaga Uno dengan 
didampingi dua pria lainnya, yang juga menunjukan simbol finger heart.
Pada foto beberapa perempuan Korea Selatan yang sudah dijelaskan, 
terdapat keterangan “Mengenal Fienger Heart, Gestur Cinta yang Populer 
di Korea Selatan.” Sedangkan di bagian foto Kang Emil dengan Sandi 
bersama dua orang pria lainnya, tertulis “waspada, Ridwan Kamil main dua
 kai.”
Menanggap hal itu, Kang Emil melalui media sosial Facebook
 dan Instagramnya yakni Ridwan Kamil (@mochamadridwankamil) dan Ridwan 
Kamil (@ridwankamil) memberikan bantahan atas tudingan itu. Ia 
menyatakan dirinya memilih Calon Presiden (Capres) dan Cawapres nomor 
urut 01.
Berikut narasi lengkapnya:
“BEREDAR FOTO dengan gesture “finger heart” ala korea dengan pesan mengadu domba seperti itu.
Padahal itu adalah gesture hati :heart: sebagai simbol persahabatan 
saya dengan Bang Sandi Uno, agar para pendukung 01 dan 02 tidak usah 
saling bertengkar. Hormati perbedaan pilihan tanpa harus bermusuhan. 
Saya sudah berketetapan dan mengumumkan ke publik akan mendukung 01 
dengan segala pertimbangan dan koalisi politiknya.
Semoga ini bisa menjelaskan. Mungkin pelaku politik hari ini kurang paham simbol-simbol budaya milenial :grinning:
Hatur Nuhun,” tulis akun Facebook dan Instagram Ridwan Kamil Kamis (7/2).
Selain itu, setelah dilakukan penulusuran dengan mesin pencari, 
diketahui baju yang dikenakan Kang Emil dengan Sandi sama seperti saat 
ketika keduanya bertemu sambil minum kopi dan bermain catur di Bandung, 
Rabu (23/1) lalu.
Terkait pertemuan itu Kang Emil menyatakan 
sebagai bukti dirinya dan Sandi memiliki hubungan yang akrab. Perbedaan 
pilihan politik, tak mesti membuat hubungan keduanya menjadi renggang.
“Dari dulu juga bersahabat, perbedaan tidak harus mengurangi  persahabatan. Saya berada di kubu 01, beliau calon di 02, tidak harus  terlihat jadi tegang walaupun mungkin para pendukung-pendukungnya yang  mempersepsikan kan,” kata Kang Emil."
