date,URL,Title,Full text
"Agustus 8, 2018",https://turnbackhoax.id/2018/08/08/benar-kepolisian-ntb-bantah-adanya-kabar-perampokan-di-kopang-pasca-gempa-lombok/,[BENAR] “Kepolisian NTB Bantah Adanya Kabar Perampokan di Kopang Pasca Gempa Lombok”,"Namun tampaknya postingan dari akun Iskandar telah dihapus sementara postingan dari akun QoRii masih bisa ditemukan. Konten postingan yang disertai beberapa foto dari kedua akun tersebut berbunyi;
“InnalillahiwainnailaihirojiunTedaitm aran semetonDibunuh salah seorang perampok di kopang berdekatan dengan polsekCari kesempatan dalam kesempitan tapi endingnya ya gini sudah …turut berduka”
Kapolres Lombok Barat, AKBP Heri Wahyudi menyatakan kabar tersebut adalah berita bohong dan meminta masyarakat agar tidak percaya. “Pemberitaan tentang adanya perampokan itu adalah hoax, yang bertujuan membuat resah masyarakat. Bila menjadi korban segera laporkan ke kami bukan menyebarkan melalui media sosial, karena akan berdampak buruk di masyarakat,” kata AKBP Heri, Selasa (7/8).
AKBP Heri pun menghimbau kepada masyarakat agar waspada. Salah satu caranya dapat dilakukan dengan mengadakan Poskamling di pemukiman masing – masing. “Kami bersama Bhabinkamtibmas akan tetap melindungi masyarakat, dari kejahatan meskipun kami menjadi korban juga,” tegas AKBP Heri.
Di sisi yang sama Kabid Humas Polda Nusa Tenggara Barat, AKBP Komang Suartana juga meminta kepada masyarakat turut menjaga kondusifitas. Diantaranya dengan tidak menyebar isu – isu yang meresahkan.
“Tetap waspada, tetapi juga tetap menjaga kondusifitas opini masyarakat agar tidak resah, terutama terkait isu semalam yang dikatakan di Kopang itu Hoax,” ujar AKBP Komang.
“Kita tidak ingin peristiwa isu penculikan anak terulang kembali lantaran tidak bisa menjaga opini. Patroli tetap ditingkatkan oleh kepolisian, namun partisipasi masyarakat menjaga lingkungan juga sangat diharapkan,” pungkas AKBP Komang.
Meski sudah diberikan klarifikasi, terjadi salah paham dari Warga Dusun Nyangget, Desa Senteluk yang mengira warga dari desa tetangganya yang bersama-sama mengungsi akibat bencana gempa di Posko pengungsian Lapangan Nyangget Desa Sinteluk, Kecamatan Batulayar, Lombok Barat adalah maling atau perampok seperti yang tersebar dalam informasi bohong di media sosial.
Kapolsek Senggigi, Akp Arjuna Wijaya SIK yang dihubungi menerangkan korban kesalah pahaman warga ini bernama Komarudin. Dia tinggal di Dusun Buwuh, Desa Meninting Kecamatan Batulayar, Lombok Barat.
“Korban merupakan pendatang dari Jawa dan menikah dengan warga di tempatnya tinggal sekarang dan bersama keluarganya juga mengungsi di posko pengungsian Lapangan Nyangget, Desa Senteluk,” ujar AKP Arjuna.
Dikatakan dia, karena warga tidak mengenali pelaku dan sudah tersulut sebelumnya dengan informasi hoax tentang isu pencurian dan perampokan yang santer di media sosial maka warga melakukan pengeroyokan karena korban dianggap mencurigakan.
Untung saja petugas patroli dari Polsek Senggigi segera datang ke TKP dan mengamankan korban dari dari amukan massa itu lalu kemudian membawa korban ke RS Bhayangkara untuk menjalani perawatan karena mengalami luka cukup serius terutama pada kepala.
“Kami sudah kroscek tentang identitasnya ternyata benar korban adalah pengungsi di posko dekat tempat dia diamuk massa tadi,” terang AKP Arjuna.
Dilanjutakan dia, petugas saat itu langsung menghimbau warga di TKP untuk membubarkan diri dan tenang serta menjelaskan kesalahfahaman tersebut.
“Kami perintahkan anggota patroli ke semua dusun-dusun di desa – desa se-Kecamatan Batulayar untuk menghimbau seluruh warga agar tetap tenang, waspada dan tidak mempercayai isu-isu khususnya tentang maling dan rampok yang kini berkembang padahal tidak benar (hoax),” jelasnya."
"Agustus 7, 2018",https://turnbackhoax.id/2018/08/07/benar-pks-dan-gerindra-purwakarta-bantah-pasang-spanduk-yang-dinilai-provokatif/,[BENAR] “PKS dan Gerindra Purwakarta Bantah Pasang Spanduk yang Dinilai Provokatif”,"Spanduk itu bertuliskan “Kami Caleg Partai Gerindra dan PKS Menolak Khilafah. Indonesia Damai Menolak Khilafah di Wilayah Purwakarta. Barisan Muda Muslim Purwakarta.” Di sisi kanan dan kiri spanduk tersebut terpasang logo PKS dan Gerindra.
Humas DPD PKS Kabupaten Purwakarta, Agus Budiono menyatakan PKS bersama caleg tidak pernah mengeluarkan statemen dan memasang seperti yang tercantum pada spanduk, selain itu tidak mempunyai hubungan apa pun dengan Barisan Muda Muslim Purwakarta yang namanya terpampang dalam spanduk tersebut.
“Keberadaan spanduk tersebut dinilai provokatif, terlebih menjelang pilpres dan pileg. Hingga saat ini spanduk yang ditemukan sudah diturunkan dan dijadikan barang bukti,” tegas Agus.
Agus pun menjelaskan PKS merasa dirugikan dengan pernyataan-pernyataan tersebut. Ia meminta kepada aparat yang berwenang untuk mengusut pihak-pihak yang dengan sengaja telah memasangnya hingga menimbulkan keresahan di kalangan masyarakat.
Di sisi yang sama Ketua DPC Gerindra Kabupaten Purwakarta, Sri Puji Utami juga memberikan klarifikasinya. “Itu fitnah,” katanya."
"Agustus 7, 2018",https://turnbackhoax.id/2018/08/07/benar-pernyataan-sikap-netral-universitas-indonesia-ui/,[BENAR] Pernyataan Sikap Netral Universitas Indonesia (UI),
"Agustus 3, 2018",https://turnbackhoax.id/2018/08/03/benar-knpi-sumut-bantah-terima-mobil-bekas-dprd-sumut/,[BENAR] KNPI Sumut Bantah Terima Mobil Bekas DPRD Sumut,
"Agustus 2, 2018",https://turnbackhoax.id/2018/08/02/benar-hmi-klarifikasi-terkait-isu-memberi-dukungan-politik-ke-partai-berkarya/,[BENAR] HMI Klarifikasi Terkait Isu Memberi Dukungan Politik Ke Partai Berkarya,
"Agustus 1, 2018",https://turnbackhoax.id/2018/08/01/benar-projo-bantah-lakukan-penghadangan-terhadap-neno-warisman/,[BENAR] “Projo Bantah Lakukan Penghadangan Terhadap Neno Warisman”,"Berdasarkan peristiwa ini, Neno mengatakan pelaku penghadangannya diantaranya ialah berasal dari relawan Pro Jokowi (Projo). Neno mengakui pernyataan ini didapat dari informasi salah seorang politisi di Batam.
“Saya dengar (yang menghadang itu massa) dari Projo, dari apa gitulah. Itu juga kata si anggota DPRD dari PAN. Saya nggak tahu, orang saya nggak kenal semuanya. Sama sekali saya nggak tahu.
Mendapat informasi ini, Ketua Umum Projo, Budi Arie Setiadi pun memberikan bantahannya. Menurutnya, apa yang dikatakan Neno tidak benar adanya.
“Janganlah melemparkan tuduhan palsu, fitnah, dan hoax,” kata Ketua Umum Projo, Budi Arie Setiadi, Selasa (31/7).
Budi menjelaskan Projo adalah organisasi pendukung Jokowi yang selalu mengedepankan cara-cara damai. Ia pun mengimbau agar pihak Neno tidak memfitnah hanya untuk mendapatkan kekuasaan.
“Projo adalah organisasi yang mengedepankan nilai-nilai kedamaian dan menebarkan optimisme untuk negeri. Janganlah karena nafsu kekuasaan kita jadi menebarkan dan menyuburkan dendam sesama anak bangsa,” kata Budi.
Di sisi lain, mantan Sekretaris Jendral (Sekjen) Projo, Guntur Siregar meminta kepada aparat hukum mengusut tuntas kasus penghadangan terhadap Neno. Dan Ia juga mengatakan jika memang ada dari relawan Projo yang melakukan penghadangan, berarti orang tersebut tidak mengerti aturan.
“Kalau betul ada relawan Projo di Batam terlibat demo di bandara untuk menolak Neno Warisman saya yakin orang itu tidak mengerti aturan hukum. Itu memalukan,” ujar Guntur, Selasa (31/7).
Diketahui acara deklarasi 2019 Ganti Presiden di Batam tetap terlaksana dan dihadiri Neno dengan mendapat pengawalan ketat dari kepolisian. Neno juga menginformasikan relawan 2019 Ganti Presiden akan melakukan deklarasi kembali di beberapa daerah dalam waktu dekat, seperti di Banten dan beberapa daerah Jawa Barat. Kemudian menyusul Lampung, Makassar, Lombok, Palu, Jambi, hingga Aceh."
"Juli 27, 2018",https://turnbackhoax.id/2018/07/27/benar-polri-tidak-lakukan-perubahan-pelat-kendaraan-bermotor-menjadi-warna-warni/,[BENAR] “Polri Tidak Lakukan Perubahan Pelat Kendaraan Bermotor Menjadi Warna – Warni”,"Kadiv Humas Polri, Irjen Setyo Wasisto menyatakan jika informasi soal pelat nomor warna-warni yang beredar di media sosial adalah tidak benar adanya atau hoaks. Perubahan pelat nomor kendaraan masih dikaji.
“Pelat yang warna-warni itu hoax,” kata Irjen Setyo, Jumat (27/7).
Meski begitu Karo Penmas Polri, Brigjen M Iqbal tak menampik adanya rencana pergantian pelat nomor kendaraan bermotor nantinya. Langkah ini untuk memudahkan identifikasi kendaraan berbasis IT.
“Nanti pelat nomornya seperti aplikasi face recognition ya.
Brigjen M Iqbal pun menjelaskan rencana dari pergantian pelat nomor kendaraan bermotor dimaksudkan untuk mengurangi kecelakaan dan unsur pidana. Misalnya jika ada yang ngebut polisi langsung bisa menghubungi pengemudi (driver).
“Bisa kita hubungi si driver bahwa Anda melebihi kecepatan di kilometer sekian. Rencananya ini untuk semua kendaraan demi peningkatan pelayanan dan faktor keselamatan dan ketertiban lalu lintas,” pungkas Brigjen M Iqbal.
Selain melalui media daring, klarifikasi terhadap isu pergantian pelat kendaraan bermotor warna – warni terdapat di media sosial twitter @Sosmed_NTMC dan Instagram @multimedia.humaspolri.
@Sosmed_NTMC menulis “HOAX “WARNA- WARNI PELAT NOMOR KENDARAAN DI INDONESIA” #StopPelanggaranStopKecelakaanKeselamatanUntukKemanusiaan,” pada Kamis (26/7).
Dan @multimedia.humaspolri menuliskan “Be Smart Netizen. Telah beredar informasi di media sosial yang mengatasnamakan Korlantas Polri terkait plat nomor kendaraan. Korlantas Polri tidak pernah mengeluarkan informasi tersebut. Konten tersebut adalah HOAX .Be Smart Netizen #stophoax,” pada Jumat (27/7)."
"Juli 27, 2018",https://turnbackhoax.id/2018/07/27/benar-tidak-ada-klaim-dari-anies-mengenai-merancang-lapangan-banteng-dari-0/,[BENAR] “Tidak Ada Klaim dari Anies Mengenai Merancang Lapangan Banteng Dari 0”,
"Juli 26, 2018",https://turnbackhoax.id/2018/07/26/benar-klarifikasi-kemenkes-terkait-tuduhan-penggunaan-foto-tanpa-izin-untuk-bungkus-rokok/,[BENAR] Klarifikasi Kemenkes Terkait Tuduhan Penggunaan Foto Tanpa Izin Untuk Bungkus Rokok,
"Juli 25, 2018",https://turnbackhoax.id/2018/07/25/benar-kpud-dki-jakarta-belum-temukan-nama-mantan-wali-kota-jakpus-yang-dikabarkan-maju-caleg-dari-pdi-p/,[BENAR] “KPUD DKI Jakarta Belum Temukan Nama Mantan Wali Kota Jakpus yang Dikabarkan Maju Caleg dari PDI-P”,"Paska berhentinya Mangara, ada isu yang mengatakan dirinya maju sebagai Caleg dari Partai PDI-P pada 2019 nanti.
Gubernur DKI Jakarta, Anies Baswedan yang sempat mendengar kabar tersebut mengaku gembira. “Alhamdulillah, saya senang memdengar itu beberapa hari lalu, bahwa pak Mangara ada pilihan untuk menjadi caleg, saya senang,” tutur Anies, Selasa (17/7).
Menurut Anies bila Mangara terpilih dan dipercaya sebagai anggota dewan, Anies mengatakan hal itu sama saja yakni mengabdi kepada Provinsi DKI Jakarta.
“Kalau beliau terpilih akan mengabdi di legislatif tapi tetap di Pemprov DKI, lingkungan Pemprov kan terdiri dari eksekutif dan legislatif,” ujarnya.
Namun terbaru, kabar Pencalegan Mangara Pardede dari PDI-P ini segera diklarifikasi oleh KPU DKI Jakarta. Komisioner KPU DKI Jakarta Bidang Teknis Nurdin, mengaku belum menemukan nama Mangara Pardede sebagai Bacaleg PDI-P.
“Untuk Mangara Pardede sementara ini tidak ada namanya dalam daftar caleg,” kata Nurdin,, Senin (23/7)."
"Juli 24, 2018",https://turnbackhoax.id/2018/07/24/benar-ustaz-fadlan-garamatan-tidak-maju-sebagai-caleg-dari-pdip/,[BENAR] Ustaz Fadlan Garamatan Tidak Maju Sebagai Caleg Dari PDIP,
"Juli 23, 2018",https://turnbackhoax.id/2018/07/23/benar-wali-kota-semarang-bantah-ada-kelurahan-yang-masuk-zona-merah-difteri-di-daerahnya/,[BENAR] “Wali kota Semarang Bantah Ada Kelurahan yang Masuk Zona Merah Difteri di Daerahnya”,"Mengetahui berita tersebut, Wali Kota Semarang Hendrar Prihadi memberikan klarifikasinya. Ia membantah Kelurahan Genuksari masuk zona merah difteri.
“Itu hoaks! Memang ada kasus difteri di sana, tetapi sudah ditangani sedulur-sedulur Dinas Kesehatan Kota Semarang sehingga tidak ada namanya zona merah. Apalagi, sampai tidak boleh lewat daerah itu,” katanya.
Hendi, sapaan akrab Hendrar Prihadi itu, menyebutkan kasus difteri yang terjadi di Genuksari itu periode Juni-Juli 2018 dengan jumlah tujuh kasus, sedangkan dua di antaranya meninggal dunia, sementara lima anak masih dirawat di RS.
“
Hendi pun memastikan pihaknya telah melakukan langkah ORI ((Outbreak Response Immunization) kepada seluruh anak di wilayah yang ditemukan kasus difteri, termasuk Kelurahan Genuksari. “Selain itu, Dinkes Kota Semarang juga telah memberikan profilaksis kepada penderita, serta memberikan erytromicin ke kontak penderita dan pengambilan ‘swab tenggorok’ ke kontak penderita,” kata Hendi.
Di sisi yang sama, Kepala Dinkes Kota Semarang Dokter Widoyono membenarkan informasi yang beredar terkait dengan zona merah difteri tersebut sebagai hoaks sehingga masyarakat tidak perlu khawatir yang berlebihan.
“Informasi zona merah difteri, waspada kalau lewat daerah itu, dan sebagainya, itu hoaks. Dari Unissula, dan banyak sumber juga sudah memastikan tidak pernah mengeluarkan informasi semacam itu,” imbuhnya.
Terakhir, Humas Fakultas Kedokteran Unissula, Drs. Purwito Soegeng Prasetijono., MKes, Fakultas Kedokteran Unissula menyatakan tidak pernah merilis himbauan kepada masyarakat terkait pentingnya menggunakan masker saat melewati Jalan Dong Biru."
"Juli 20, 2018",https://turnbackhoax.id/2018/07/20/benar-polri-bantah-kerahkan-sniper-untuk-menjaga-veneu-asian-games/,[BENAR] “Polri Bantah Kerahkan Sniper untuk Menjaga Veneu Asian Games”,"Menanggapi hal ini Karopenmas Divisi Humas Polri, Brigjen Pol Mohammad Iqbal membantah isu tersebut. “Kata siapa (menerjukan, – red) sniper? Nggak ada,” ujarnya, Kamis (19/7).
Ia pun menjelaskan pengamanan menggunakan tim sniper hanya dipergunakan apabila situasi sudah sangat genting.
Menurutnya karena situasi keamanan jelang gelaran Asian Games 2018 masih dinilai kondusif, maka tim sniper tidak diterjunkan.
“Polri memang akan mengerahkan tim pengamanan Asian Games 2018. Namun, pengamanan dilakukan dengan tidak berlebihan seperti menurunkan sniper,” tegas Iqbal.
Sebelumnya Kapolri Tito Karnavian menyatakan ada tiga ancaman dalam kegiatan Asian Games 2018 di Jakarta dan Palembang. Hal itu disampaikan dalam rapat kerja dengan Komisi III di Gedung DPR, Jakarta, Kamis (19/7).
Tito mengatakan ketiga ancaman tersebut adalah terorisme, kejahatan jalanan, dan kemacetan lalu lintas. “Mengahadapi Asian Games ini memang ancaman utama yang paling kami utamakan adalah terorisme. Kedua adalah masalah kejahatan jalanan, dan ketiga adalah kemacetan lalu lintas,” kata Tito."
"Juli 19, 2018",https://turnbackhoax.id/2018/07/19/benar-menpan-rb-bantah-maju-sebagai-caleg/,[BENAR] “MenPAN-RB Bantah Maju sebagai Caleg”,"Namun di PAN terjadi silang pendapat antara pengurus struktural partai dengan MenPAN-RB, Asman Abnur yang juga merupakan kadernya.
Wakil Ketua Umum PAN, Hanafi Rais menyatakan telah mendaftarkan Menteri Asman sebagai Caleg. “Memang partai menugaskan kader terbaik untuk maju, termasuk menteri sekarang ini,” kata Hanafi, Selasa (17/7).
Ketua DPP PAN, Yandri Susanto menerangkan bahwa Menteri Asman akan maju dari Dapil Kepulauan Riau. Dapil itu adalah dapil yang sama saat Asman maju sebagai caleg dan berhasil lolos ke Senayan pada 2004, 2009 dan 2014.
Ketika dikonfirmasi wartawan, Menteri Asman justru membantah pernyataan dari keduanya. Ia mengatakan tidak pernah mendaftarkan dirinya sebagai Caleg.
“Saya belum nyaleg,” kata MenPAN-RB, Asman Abnur di Kompleks Istana Kepresidenan Bogor, Jawa Barat, Rabu (18/7/2018).
Menteri Asman pun menegaskan dirinya masih ingin fokus kerja. Ia mengklaim tidak pernah mendaftar sebagai caleg dari Dapil Kepulauan Riau.
“Nggak. Nggak daftar saya,” ucap Asman."
"Juli 18, 2018",https://turnbackhoax.id/2018/07/18/benar-kondisi-wilayahnya-disebut-tidak-aman-bupati-nduga-papua-beri-klarifikasi/,"[BENAR] KONDISI WILAYAHNYA DISEBUT TIDAK AMAN, BUPATI NDUGA PAPUA BERI KLARIFIKASI","“Saya berterimakasih kepada TNI Polri karena telah bekerja keras untuk menstabilkan keamanan di Nduga. Terkait isu keamanan di Nduga tidak aman di media sosial itu tidak benar dan Hoax,” tutur Bupati Nduga Yarius Gwijangge.
Melansir dari sindonews.comBupati Nduga, Yarius Gwijangge mengatakan, meskipun ada aksi teror penembakan yang dilakukan Kelompok KKSB beberapa waktu lalu, namun situasi tetap aman dan terkendali. Karena TNI Polri langsung merespon dengan baik kemudian bertindak sesuai prosedur untuk menjaga keamanan masyarakat Nduga.
“Saya mengapresiasi kinerja TNI/Polri dan juga berterima kasih karena telah berhasil menstabilkan keamanan di Kabupaten Nduga,” tutur Bupati Nduga, Yarius Gwijangge.
Sementara itu terkait maraknya dengan informasi bahwa situasi di Distrik Kenyam tidak aman, Bupati Yarius membantah dengan tegas semua isu tersebut tidak benar dan Hoax.
Menurut Bupati Nduga, Yarius Gwijangge, siapapun dia orangnya, jangan mengomentari soal keamanan di Kabupaten Nduga kalau belum datangdanmelihat secara langsung apa sebenarnya yang terjadi di Kabupaten Nduga.
“Saya sebagai Bupati Nduga tidak keluar kemana-mana saya masih tetap berada di Nduga dan situasi kami disini aman-aman saja,” ungkap Bupati Nduga.
Bupati Nduga, Yarius Gwijangge mengungkapkan, TNI/Polri bersama pemerintah kini telah mengambil langkah-langkah persuasif guna menghilangkan rasa trauma masyarakat pascapenembakan dan pembantaian satu keluarga yang dilakukan oleh KKSB beberapa waktu.
“Harapan kami, para pelaku dalam hal KKSB harus segera ditangkap sehingga mereka mempertanggungjawabkan perbuatannya sesuai dengan jalur hukum,” tutur Bupati  Nduga, Yarius Gwijangge.
Bupati Nduga juga mengimbau kepada seluruh ASN Kabupaten Nduga untuk agar segera melaksanakan aktivitas pemerintahan seperti biasanya guna memberikan pelayanan kepada masyarakat."
"Juli 17, 2018",https://turnbackhoax.id/2018/07/17/benar-bkd-provinsi-papua-tidak-pernah-janjikan-jatah-penerimaan-cpns-2018/,[BENAR] BKD Provinsi Papua Tidak Pernah Janjikan Jatah Penerimaan CPNS 2018,
"Juli 15, 2018",https://turnbackhoax.id/2018/07/15/benar-kementerian-pupr-beri-klarifikasi-perihal-isu-pengambilalihan-proyek-enam-ruas-tol-di-dki-jakarta/,[BENAR] Kementerian PUPR Beri Klarifikasi Perihal Isu Pengambilalihan Proyek Enam Ruas Tol di DKI Jakarta,
"Juli 14, 2018",https://turnbackhoax.id/2018/07/14/benar-klarifikasi-kepolisian-terkait-rumor-korban-pembunuhan-oleh-pendeta-henderson-tengah-hamil/,[BENAR] KLARIFIKASI KEPOLISIAN TERKAIT RUMOR KORBAN PEMBUNUHAN OLEH PENDETA HENDERSON TENGAH HAMIL,"Sebelumnya sempat beredar kabar yang diperoleh dari pernyataan tersangka yakni Handerseon, yang menyebut bahwa korban pembunuhan tengah dalam kondisi hamil tiga bulan. Namun hal tersebut rupanya tidak benar, karena setelah dilakukan pengecekan melalui proses autopsi tidak ditemukan tanda-tanda kehamilan pada korban yang juga merupakan anak angkat tersangka."
"Juli 9, 2018",https://turnbackhoax.id/2018/07/09/benar-kemenhub-beri-klarifikasi-atas-kabar-yang-menyebutkan-ada-2-pegawai-ditahan-usai-kebakaran-di-gedung-kemenhub/,[BENAR] Kemenhub Beri Klarifikasi Atas Kabar yang Menyebutkan Ada 2 Pegawai Ditahan Usai Kebakaran di Gedung Kemenhub,
"Juli 6, 2018",https://turnbackhoax.id/2018/07/06/benar-polisi-membubarkan-parade-lgbt-di-istanbul-turki/,"[BENAR] Polisi Membubarkan Parade LGBT di Istanbul, Turki",
"Juli 6, 2018",https://turnbackhoax.id/2018/07/06/benar-kantor-staf-kepresidenan-mengklarifikasi-bahwa-tidak-ada-dokumen-penting-negara-yang-hilang-pada-kasus-pencurian-terhadap-stafnya/,[BENAR] Kantor Staf Kepresidenan Mengklarifikasi Bahwa Tidak Ada Dokumen Penting Negara yang Hilang Pada Kasus Pencurian Terhadap Stafnya,
"Juli 3, 2018",https://turnbackhoax.id/2018/07/03/benar-bi-bantah-kebijakan-kpr-dp-0-mencontoh-anies-sandi/,[BENAR] “BI Bantah Kebijakan KPR DP 0% Mencontoh Anies – Sandi”,"“Kami bersyukur bahwa apa yang menjadi inisiatif di Jakarta, sekarang juga dilaksanakan di level nasional,” ujar Anies, Sabtu (30/6).
“Alhamdulillah inisiatif yang DKI lakukan dapat tanggapan positif dari BI, sudah mengeluarkan peraturan yang merelaksasi,” kata Sandi, Senin (2/7).
Pernyaataan dari kedua pemimpin Jakarta ini ini pun mendapatkan respon dari BI. Asisten Gubernur Kepala Departemen Kebijakan Makroprudensial BI, Filianingsih Hendarta mengatakan kebijakan tersebut adalah untuk kepentingan masyarakat umum yang bertujuan meningkatkan kemampuan daya beli masyarakat terhadap perumahan.
“Makroprudensial ini melihatnya secara besar, bukan dilihat berdasarkan satu per satu kepentingan. Kalau ada pemerintah itu punya kepentingan (tertentu seperti di DKI Jakarta), itu silakan saja direalisasikan,” ujar Filianingsih, Senin (2/7).
Filianingsih pun menjelaskan kebijakan Loan to Value (LTV) sudah dari tahun 2012 silam, ketika bank sentral nasional belum mengatur rasio uang muka kepada bank yang akan memberikan fasilitas KPR kepada nasabah. Artinya, kebijakan ini sejatinya sudah ada dari dulu, bukan karena inisiatif Anies-Sandi.
“Ini sudah terjadi sejak 2012, jadi bukan sekarang,” tegas Filianingsih.
Meski begitu, Filianongsih menerangkan dalam menjalankan kebijakan ini, BI sempat mengetatkannya dan melonggarkannya. Pada 2012-2014, BI sengaja memberlakukan pengetatan kebijakan makroprudensial dengan memberlakukan kebijakan LTV, karena di rentang periode itu, harga rumah dan KPR meningkat tinggi.
Dan mulai 2015-2016, BI kembali melonggarkan kebijakan LTV. “Kalau ini booming, kebijakan itu akan kami perketat. Tapi ketika belum terlalu tinggi seperti saat ini, itu kami longgarkan,” pungkas Filianingsih."
"Juli 3, 2018",https://turnbackhoax.id/2018/07/03/benar-pbnu-tidak-pernah-menuding-pemerintah-menggunakan-dana-csr-bumn-digunakan-untuk-gerakan-khilafah/,[BENAR] PBNU Tidak Pernah Menuding Pemerintah Menggunakan Dana CSR BUMN Digunakan Untuk Gerakan Khilafah,
"Juli 2, 2018",https://turnbackhoax.id/2018/07/02/benar-bi-bantah-keluarkan-uang-berstempel-2019-ganti-presiden-dan-prabowo-satria-piningit/,[BENAR] “BI Bantah Keluarkan Uang Berstempel 2019 Ganti Presiden dan Prabowo Satria Piningit”,"Deputi Direktur Kantor Perwakilan BI Provinsi Sulawesi Utara, Buwono Budi Santoso pun angkat bicara guna meluruskan hal tersebut. Ia menyatakan dengan tegas bahwa pihaknya tidak pernah mengeluarkan uang itu.
“BI tidak pernah mengeluarkan uang rupiah yang berstempel ganti presiden 2019 dan Prabowo Subianto,” ujar Buwono, Jumat (22/6).
Meski begitu, Buwono mengaku belum menemukan uang fisik dengan stempel tersebut. “Kami belum dapat uangnya sehingga belum dapat mengklarifikasi uang asli atau bukan,” katanya.
Di sisi yang sama, Direktur Eksekutif Kepala Departemen Komunikasi BI, Agusman menyatakan uang tersebut masih dapat digunakan bila masih tersebar di masyarakat. Namun, jika masuk kembali ke BI maka harus dimusnahkan karena dianggap tidak layak edar.
“Ya, intinya kalau uang sudah rusak atau ada diberi stempel atau apa masuk di BI, pasti dimusnahkan dan pasti dianggap tidak lagi layak edar,” tambah Agusman.
Terakhir, Agusman menyatakan telah mengambil langkah – langkah agar masyarakat tetap tenang dan tidak panik dalam menghadapi masalah ini.
“Masa kita tarik, panik dong masyarakat. Kita harus pakai cara baik menjaga ketenangan Stabilisas,” pungkas Agusman."
"Juli 2, 2018",https://turnbackhoax.id/2018/07/02/benar-kemenpan-rb-tidak-terlibat-dalam-acara-seminar-nasional-pengadaan-tes-cpns-2018/,[BENAR] KemenPAN-RB Tidak Terlibat Dalam Acara Seminar Nasional Pengadaan Tes CPNS 2018,
